Autonomous Racing Research/Archive/Homework1/task4/data/eng2/4_optimized_gearing/torque.csv

Time,Mechanical/Crankshaft static torque (ICE),Mechanical/Static torque (E-Network 48V/E-Motor P1)
s,N.m,N.m
0.0,0.0,-0.0
1.0,185.72480554876876,56.81164492356616
2.0,-5.2877582350615455,31.565547131109618
3.0,166.91647080879682,31.875165656723937
4.0,67.76352308217483,32.35446656090267
5.0,-10.31075007840792,0.0
6.0,225.9075581540477,34.09243450295981
7.0,97.85822842802418,32.682909692997264
8.0,-8.567239772143775,0.0
9.0,225.90756008544506,34.09243456622287
10.0,146.5984796550178,33.21711721132957
11.0,51.556851983026434,32.17801144696281
12.0,-9.567053915247332,0.0
13.0,225.90755187852008,34.09243429740455
14.0,225.90756526414748,34.092434735851576
15.0,225.90756526414748,34.092434735851576
16.0,212.05902562205628,33.9390556785529
17.0,132.51752407133196,33.06248237094365
18.0,99.04523396153326,30.711756677319052
19.0,86.86840895970212,26.801643643794584
20.0,83.55193585998467,23.683051454651753
21.0,83.63411111169091,21.156835920474663
22.0,84.87817709048451,19.096633550136463
23.0,86.39277714419674,17.411672057194373
24.0,87.84259746749137,16.03201115488989
25.0,89.11872733038089,14.9018582110381
26.0,90.20164371086578,13.97599076141385
27.0,91.10471448628923,13.217496820962754
28.0,91.85129058542665,12.59615976896769
29.0,92.46575433938555,12.087216494236078
30.0,92.9703142897061,11.670366531054697
31.0,93.38411917115594,11.32896780929283
32.0,93.72326696148875,11.04937902485534
33.0,94.00112364471211,10.820420320500052
34.0,94.22871678244908,10.632930568663351
35.0,94.41511458043138,10.47940391022652

CE1B/ECE140-Linear-Circuits/sources/10_Sinusoidal_Steady_State_Power_Calculations/10_Sinusoidal_Steady_State_Power_Calculations.md

# INSTANTANEOUS POWER

$$p = \frac{V_m I_m}{2} \cos(\theta_v - \theta_i) + \frac{V_m I_m}{2} \cos(\theta_v - \theta_i) \cos 2\omega t - \frac{V_m I_m}{2} \sin(\theta_v - \theta_i) \sin 2\omega t.$$
(10.3)

# AVERAGE (REAL) POWER

$$P = \frac{V_m I_m}{2} \cos(\theta_v - \theta_i), \tag{10.5}$$

# REACTIVE POWER

$$Q = \frac{V_m I_m}{2} \sin(\theta_v - \theta_i). \tag{10.6}$$

# 10.3 [The RMS Value and Power](#page--1-0) [Calculations](#page--1-0)

In Example 10.3, we use rms values to calculate power.

# ASSESSMENT PROBLEM

10.3 The periodic triangular current in Example 9.4, repeated here, has a peak value of 240 mA. Find the average power that this current delivers to a 1 kΩ resistor.

# COMPLEX POWER, ALTERNATE FORM

Example 10.5 uses Eq. 10.14 in a power calculation, with the phasor representation of the voltage and current from Example 10.1.

# Alternate Forms for Complex Power

Examples 10.6–10.8 demonstrate various power calculations in circuits operating in the sinusoidal steady state.

# ASSESSMENT PROBLEMS

- 10.5 The load impedance in the circuit shown is shunted by a capacitor having a capacitive reactance of − Ω 125 . Calculate:
  - a) the rms phasors **V**L and **I** <sup>L</sup> ,
  - b) the average power and magnetizing reactive power absorbed by the ( ) 120 90 + Ω *j* load impedance,
  - c) the average power and magnetizing reactive power absorbed by the ( ) 4 3 + Ω *j* line impedance,
  - d) the average power and magnetizing reactive power delivered by the source, and

10.6 The voltage at the terminals of a load is 400 V(rms). The load is absorbing an average power of 6 kW and a magnetizing reactive power of 8 kVAR. Derive two equivalent impedance models of the load.

# ASSESSMENT PROBLEM

- 10.8 The source voltage in the circuit shown is 80 cos 250 V*t* .
  - a) What impedance should be connected across terminals a and b for maximum average power transfer?
  - b) What is the average power transferred to the impedance in (a)?
  - c) Assume that the load is restricted to pure resistance. What size resistor connected across a and b will result in the maximum average power transferred?
  - d) What is the average power transferred to the resistor in (c)?

#### **Sections 10.1–10.2**

- **10.2** Show that the maximum value of the instantaneous **MULTISIM** power given by Eq. 10.3 is *P P* + +2 2 *Q* and that the minimum value is *P P Q* . − +2 2
- **10.3** a) A college student wakes up on a warm day. The central air conditioning is on, and the room feels comfortable. She turns on the dishwasher, takes some milk out of the old refrigerator, and puts some oatmeal in the microwave oven to cook. If all of these appliances in her dorm room are supplied by a 120 V(rms) branch circuit protected by a 60 A(rms) circuit breaker, will the breaker interrupt her morning?
  - b) Her roommate wakes up and moves wet clothes from the washer to the dryer. Before she turns on the dryer, what does she ask her roommate to turn off so the circuit breaker is not tripped?
- **10.4** a) Calculate the real and reactive power associated with each circuit element in the circuit in [Fig. P9.57.](#page--1-0)
  - b) Verify that the average power generated equals the average power absorbed.
  - c) Verify that the magnetizing vars generated equal the magnetizing vars absorbed.
- **10.5** Repeat Problem 10.4 for the circuit shown in Fig. P9.62.
- **10.6** Find the average power delivered by the ideal current source in the circuit in Fig. P10.6 if *i t* 30 cos 25, 000 mA. *<sup>g</sup>* = **PSPICE MULTISIM**

- e) Does the load absorb or generate magnetizing vars?
- f) What is the power factor of the load?
- g) What is the reactive factor of the load?
- **10.8** Find the average power dissipated in the 20 Ω resistor in the circuit seen in Fig. P10.8 if *i t* = 15 cos 10,000 A. *<sup>g</sup>* **PSPICE**

### Figure P10.29

**10.31** Assume the factory described in Problem 10.30 is fed from a line having an impedance of 0.02 0.16 + Ω *j* . The voltage at the factory is maintained at 4800 V(rms).

#### Figure P10.45

- **10.48** The sending-end voltage in the circuit seen in Fig. P10.48 is adjusted so that the load voltage is always 4800 V(rms). The variable capacitor is adjusted until the average power dissipated in the line resistance is minimum.
  - a) If the frequency of the sinusoidal source is 60 Hz, what is the value of the capacitance in microfarads?
  - b) If the capacitor is removed from the circuit, what percentage increase in the magnitude of **V***s* is necessary to maintain 4800 V(rms) at the load?
  - c) If the capacitor is removed from the circuit, what is the percentage increase in line loss?

# Figure P10.61

**10.63** The variable load resistor *R*L in the circuit shown in Fig. P10.63 is adjusted for maximum average power transfer to *R*L. **PSPICE MULTISIM**